V1,V2,V3,V4,V5,V6,V7,V8,V9,V10,id,mTurkCode,cond,orderE,orderP,orderA,Q32,Q121,Q25,Q113,Q113_TEXT,Q115,Q29,Q30,Q117,Q52,Q76_1,Q54,Q55,Q58_1,Q61,Q59_1,Q62,Q60_1,Q63,Q68,,friendly ,helpful ,honest ,social responsibility,respect for tradition ,flexibility,a sense of community,social order ,solitude,thrift,sustainability ,organization,self respect ,being the best,calmness,politeness,gallantry,interdependence,safety,discipline,dignity,nobility,persistence,initiative ,responsiveness,goodness,humor,dynamism,audacity,bravery,experience,self‑discipline ,conflict resolution,vigor,self-sufficiency,charm,sensuality,generosity,consideration,desire,harmony,charity,entrepreneurial ,intimacy,understanding,dominance,soundness,productiveness,deference,progress,friendly ,helpful ,honest ,social responsibility,respect for tradition ,flexibility,a sense of community,social order ,solitude,thrift,sustainability ,organization,self respect ,being the best,calmness,politeness,gallantry,interdependence,safety,discipline,dignity,nobility,persistence,initiative ,responsiveness,goodness,humor,dynamism,audacity,bravery,experience,self‑discipline ,conflict resolution,vigor,self-sufficiency,charm,sensuality,generosity,consideration,desire,harmony,charity,entrepreneurial ,intimacy,understanding,dominance,soundness,productiveness,deference,progress,friendly ,helpful ,honest ,social responsibility,respect for tradition ,flexibility,a sense of community,social order ,solitude,thrift,sustainability ,organization,self respect ,being the best,calmness,politeness,gallantry,interdependence,safety,discipline,dignity,nobility,persistence,initiative ,responsiveness,goodness,humor,dynamism,audacity,bravery,experience,self‑discipline ,conflict resolution,vigor,self-sufficiency,charm,sensuality,generosity,consideration,desire,harmony,charity,entrepreneurial ,intimacy,understanding,dominance,soundness,productiveness,deference,progress,,,SUM of SQARES,COUNT,Polarity,SD,EP Corr,EA Corr,PA Corr,Min Corr,POSCOUNT,NEGCOUNT,RATIO POS/NEG,RATIO NEG/POS,,Q84_1(1),Q84_1(2),Q84_1(3),Q84_1(4),Q84_1(5),Q84_1(6),Q84_1(7),Q84_1(8),Q84_1(9),Q84_1(10),Q84_1(11),Q84_1(12),Q84_1(13),Q84_1(14),Q84_1(15),Q84_1(16),Q84_1(17),Q84_1(18),Q84_1(19),Q84_1(20),Q84_1(21),Q84_1(22),Q84_1(23),Q84_1(24),Q84_1(25),Q84_1(26),Q84_1(27),Q84_1(28),Q84_1(29),Q84_1(30),Q84_1(31),Q84_1(32),Q84_1(33),Q84_1(34),Q84_1(35),Q84_1(36),Q84_1(37),Q84_1(38),Q84_1(39),Q84_1(40),Q84_1(41),Q84_1(42),Q84_1(43),Q84_1(44),Q84_1(45),Q84_1(46),Q84_1(47),Q84_1(48),Q84_1(49),Q84_1(50),,,Q30_1,Q30_2,Q30_11,Q30_12,Q30_13,Q30_14,Q30_15,Q30_16,Q30_17,Q30_18,Q105,Q107,Q107_TEXT,Q109,Q109_TEXT,Q111,Q119,Q123,LocationLatitude,LocationLongitude,LocationAccuracy
ResponseID,ResponseSet,Name,ExternalDataReference,EmailAddress,IPAddress,Status,StartDate,EndDate,Finished,id,mTurkCode,cond,orderE,orderP,orderA,"    Dear potential participant,   Thank you for your interest in our study. In this study, we aim...","If you agree to participate in this study as described above, please enter your mTurk id here. Yo...",What is your sex?,Have you lived in the United States the majority of your life? ,Have you lived in the United States the majority of your life? -TEXT,What state/territory within the United States do you most often live in?,How old are you?,What race/ethnicity do you identify as?,What is your highest level of education?,In this study we ask you to rate how you feel about different concepts which are related to ideal...,"Bad, Awful Good, Nice    -&nbsp;","This ruler allows you to rate a concept in increasing degrees - Slightly, Quite, Extremely, and I...",Each concept is rated on three different rulers.  The ruler you've already seen ranges from bad a...,"Bad, /  Awful /  /  Good, /  Nice /  /    /  /   -&nbsp;", A second ruler ranges from powerless and weak to powerful and strong:,"Powerless, /  Weak /  /  Powerful, /  Strong /  /    /  /   -&nbsp;","A third ruler ranges from slow, quiet, and inactive to fast, noisy, and active:","Slow, Quiet, /  Inactive /  /  Fast, Noisy, /  Active /  /    /  /    /  /   -&nbsp;","You should base your rating on your first impression and feelings of the concept, rather than on...",On the following screens please give your ratings of concepts used to describe what people value...,,"Good, Nice Bad, Awful     (1)-&nbsp;","Good, Nice Bad, Awful     (2)-&nbsp;","Good, Nice Bad, Awful     (3)-&nbsp;","Good, Nice Bad, Awful     (4)-&nbsp;","Good, Nice Bad, Awful     (5)-&nbsp;","Good, Nice Bad, Awful     (6)-&nbsp;","Good, Nice Bad, Awful     (7)-&nbsp;","Good, Nice Bad, Awful     (8)-&nbsp;","Good, Nice Bad, Awful     (9)-&nbsp;","Good, Nice Bad, Awful     (10)-&nbsp;","Good, Nice Bad, Awful     (11)-&nbsp;","Good, Nice Bad, Awful     (12)-&nbsp;","Good, Nice Bad, Awful     (13)-&nbsp;","Good, Nice Bad, Awful     (14)-&nbsp;","Good, Nice Bad, Awful     (15)-&nbsp;","Good, Nice Bad, Awful     (16)-&nbsp;","Good, Nice Bad, Awful     (17)-&nbsp;","Good, Nice Bad, Awful     (18)-&nbsp;","Good, Nice Bad, Awful     (19)-&nbsp;","Good, Nice Bad, Awful     (20)-&nbsp;","Good, Nice Bad, Awful     (21)-&nbsp;","Good, Nice Bad, Awful     (22)-&nbsp;","Good, Nice Bad, Awful     (23)-&nbsp;","Good, Nice Bad, Awful     (24)-&nbsp;","Good, Nice Bad, Awful     (25)-&nbsp;","Good, Nice Bad, Awful     (26)-&nbsp;","Good, Nice Bad, Awful     (27)-&nbsp;","Good, Nice Bad, Awful     (28)-&nbsp;","Good, Nice Bad, Awful     (29)-&nbsp;","Good, Nice Bad, Awful     (30)-&nbsp;","Good, Nice Bad, Awful     (31)-&nbsp;","Good, Nice Bad, Awful     (32)-&nbsp;","Good, Nice Bad, Awful     (33)-&nbsp;","Good, Nice Bad, Awful     (34)-&nbsp;","Good, Nice Bad, Awful     (35)-&nbsp;","Good, Nice Bad, Awful     (36)-&nbsp;","Good, Nice Bad, Awful     (37)-&nbsp;","Good, Nice Bad, Awful     (38)-&nbsp;","Good, Nice Bad, Awful     (39)-&nbsp;","Good, Nice Bad, Awful     (40)-&nbsp;","Good, Nice Bad, Awful     (41)-&nbsp;","Good, Nice Bad, Awful     (42)-&nbsp;","Good, Nice Bad, Awful     (43)-&nbsp;","Good, Nice Bad, Awful     (44)-&nbsp;","Good, Nice Bad, Awful     (45)-&nbsp;","Good, Nice Bad, Awful     (46)-&nbsp;","Good, Nice Bad, Awful     (47)-&nbsp;","Good, Nice Bad, Awful     (48)-&nbsp;","Good, Nice Bad, Awful     (49)-&nbsp;","Good, Nice Bad, Awful     (50)-&nbsp;","Powerful, Strong Powerless, Weak     (1)-&nbsp;","Powerful, Strong Powerless, Weak     (2)-&nbsp;","Powerful, Strong Powerless, Weak     (3)-&nbsp;","Powerful, Strong Powerless, Weak     (4)-&nbsp;","Powerful, Strong Powerless, Weak     (5)-&nbsp;","Powerful, Strong Powerless, Weak     (6)-&nbsp;","Powerful, Strong Powerless, Weak     (7)-&nbsp;","Powerful, Strong Powerless, Weak     (8)-&nbsp;","Powerful, Strong Powerless, Weak     (9)-&nbsp;","Powerful, Strong Powerless, Weak     (10)-&nbsp;","Powerful, Strong Powerless, Weak     (11)-&nbsp;","Powerful, Strong Powerless, Weak     (12)-&nbsp;","Powerful, Strong Powerless, Weak     (13)-&nbsp;","Powerful, Strong Powerless, Weak     (14)-&nbsp;","Powerful, Strong Powerless, Weak     (15)-&nbsp;","Powerful, Strong Powerless, Weak     (16)-&nbsp;","Powerful, Strong Powerless, Weak     (17)-&nbsp;","Powerful, Strong Powerless, Weak     (18)-&nbsp;","Powerful, Strong Powerless, Weak     (19)-&nbsp;","Powerful, Strong Powerless, Weak     (20)-&nbsp;","Powerful, Strong Powerless, Weak     (21)-&nbsp;","Powerful, Strong Powerless, Weak     (22)-&nbsp;","Powerful, Strong Powerless, Weak     (23)-&nbsp;","Powerful, Strong Powerless, Weak     (24)-&nbsp;","Powerful, Strong Powerless, Weak     (25)-&nbsp;","Powerful, Strong Powerless, Weak     (26)-&nbsp;","Powerful, Strong Powerless, Weak     (27)-&nbsp;","Powerful, Strong Powerless, Weak     (28)-&nbsp;","Powerful, Strong Powerless, Weak     (29)-&nbsp;","Powerful, Strong Powerless, Weak     (30)-&nbsp;","Powerful, Strong Powerless, Weak     (31)-&nbsp;","Powerful, Strong Powerless, Weak     (32)-&nbsp;","Powerful, Strong Powerless, Weak     (33)-&nbsp;","Powerful, Strong Powerless, Weak     (34)-&nbsp;","Powerful, Strong Powerless, Weak     (35)-&nbsp;","Powerful, Strong Powerless, Weak     (36)-&nbsp;","Powerful, Strong Powerless, Weak     (37)-&nbsp;","Powerful, Strong Powerless, Weak     (38)-&nbsp;","Powerful, Strong Powerless, Weak     (39)-&nbsp;","Powerful, Strong Powerless, Weak     (40)-&nbsp;","Powerful, Strong Powerless, Weak     (41)-&nbsp;","Powerful, Strong Powerless, Weak     (42)-&nbsp;","Powerful, Strong Powerless, Weak     (43)-&nbsp;","Powerful, Strong Powerless, Weak     (44)-&nbsp;","Powerful, Strong Powerless, Weak     (45)-&nbsp;","Powerful, Strong Powerless, Weak     (46)-&nbsp;","Powerful, Strong Powerless, Weak     (47)-&nbsp;","Powerful, Strong Powerless, Weak     (48)-&nbsp;","Powerful, Strong Powerless, Weak     (49)-&nbsp;","Powerful, Strong Powerless, Weak     (50)-&nbsp;","Fast, Noisy, Active Slow, Quiet, Inactive       (1)-&nbsp;","Fast, Noisy, Active Slow, Quiet, Inactive       (2)-&nbsp;","Fast, Noisy, Active Slow, Quiet, Inactive       (3)-&nbsp;","Fast, Noisy, Active Slow, Quiet, Inactive       (4)-&nbsp;","Fast, Noisy, Active Slow, Quiet, Inactive       (5)-&nbsp;","Fast, Noisy, Active Slow, Quiet, Inactive       (6)-&nbsp;","Fast, Noisy, Active Slow, Quiet, Inactive       (7)-&nbsp;","Fast, Noisy, Active Slow, Quiet, Inactive       (8)-&nbsp;","Fast, Noisy, Active Slow, Quiet, Inactive       (9)-&nbsp;","Fast, Noisy, Active Slow, Quiet, Inactive       (10)-&nbsp;","Fast, Noisy, Active Slow, Quiet, Inactive       (11)-&nbsp;","Fast, Noisy, Active Slow, Quiet, Inactive       (12)-&nbsp;","Fast, Noisy, Active Slow, Quiet, Inactive       (13)-&nbsp;","Fast, Noisy, Active Slow, Quiet, Inactive       (14)-&nbsp;","Fast, Noisy, Active Slow, Quiet, Inactive       (15)-&nbsp;","Fast, Noisy, Active Slow, Quiet, Inactive       (16)-&nbsp;","Fast, Noisy, Active Slow, Quiet, Inactive       (17)-&nbsp;","Fast, Noisy, Active Slow, Quiet, Inactive       (18)-&nbsp;","Fast, Noisy, Active Slow, Quiet, Inactive       (19)-&nbsp;","Fast, Noisy, Active Slow, Quiet, Inactive       (20)-&nbsp;","Fast, Noisy, Active Slow, Quiet, Inactive       (21)-&nbsp;","Fast, Noisy, Active Slow, Quiet, Inactive       (22)-&nbsp;","Fast, Noisy, Active Slow, Quiet, Inactive       (23)-&nbsp;","Fast, Noisy, Active Slow, Quiet, Inactive       (24)-&nbsp;","Fast, Noisy, Active Slow, Quiet, Inactive       (25)-&nbsp;","Fast, Noisy, Active Slow, Quiet, Inactive       (26)-&nbsp;","Fast, Noisy, Active Slow, Quiet, Inactive       (27)-&nbsp;","Fast, Noisy, Active Slow, Quiet, Inactive       (28)-&nbsp;","Fast, Noisy, Active Slow, Quiet, Inactive       (29)-&nbsp;","Fast, Noisy, Active Slow, Quiet, Inactive       (30)-&nbsp;","Fast, Noisy, Active Slow, Quiet, Inactive       (31)-&nbsp;","Fast, Noisy, Active Slow, Quiet, Inactive       (32)-&nbsp;","Fast, Noisy, Active Slow, Quiet, Inactive       (33)-&nbsp;","Fast, Noisy, Active Slow, Quiet, Inactive       (34)-&nbsp;","Fast, Noisy, Active Slow, Quiet, Inactive       (35)-&nbsp;","Fast, Noisy, Active Slow, Quiet, Inactive       (36)-&nbsp;","Fast, Noisy, Active Slow, Quiet, Inactive       (37)-&nbsp;","Fast, Noisy, Active Slow, Quiet, Inactive       (38)-&nbsp;","Fast, Noisy, Active Slow, Quiet, Inactive       (39)-&nbsp;","Fast, Noisy, Active Slow, Quiet, Inactive       (40)-&nbsp;","Fast, Noisy, Active Slow, Quiet, Inactive       (41)-&nbsp;","Fast, Noisy, Active Slow, Quiet, Inactive       (42)-&nbsp;","Fast, Noisy, Active Slow, Quiet, Inactive       (43)-&nbsp;","Fast, Noisy, Active Slow, Quiet, Inactive       (44)-&nbsp;","Fast, Noisy, Active Slow, Quiet, Inactive       (45)-&nbsp;","Fast, Noisy, Active Slow, Quiet, Inactive       (46)-&nbsp;","Fast, Noisy, Active Slow, Quiet, Inactive       (47)-&nbsp;","Fast, Noisy, Active Slow, Quiet, Inactive       (48)-&nbsp;","Fast, Noisy, Active Slow, Quiet, Inactive       (49)-&nbsp;","Fast, Noisy, Active Slow, Quiet, Inactive       (50)-&nbsp;",,Total Missing, ,,,,,,,,,,,,,  (1)-<div><em>Skip / I don&#39;t know this concept</em></div> / ,  (2)-<div><em>Skip / I don&#39;t know this concept</em></div> / ,  (3)-<div><em>Skip / I don&#39;t know this concept</em></div> / ,  (4)-<div><em>Skip / I don&#39;t know this concept</em></div> / ,  (5)-<div><em>Skip / I don&#39;t know this concept</em></div> / ,  (6)-<div><em>Skip / I don&#39;t know this concept</em></div> / ,  (7)-<div><em>Skip / I don&#39;t know this concept</em></div> / ,  (8)-<div><em>Skip / I don&#39;t know this concept</em></div> / ,  (9)-<div><em>Skip / I don&#39;t know this concept</em></div> / ,  (10)-<div><em>Skip / I don&#39;t know this concept</em></div> / ,  (11)-<div><em>Skip / I don&#39;t know this concept</em></div> / ,  (12)-<div><em>Skip / I don&#39;t know this concept</em></div> / ,  (13)-<div><em>Skip / I don&#39;t know this concept</em></div> / ,  (14)-<div><em>Skip / I don&#39;t know this concept</em></div> / ,  (15)-<div><em>Skip / I don&#39;t know this concept</em></div> / ,  (16)-<div><em>Skip / I don&#39;t know this concept</em></div> / ,  (17)-<div><em>Skip / I don&#39;t know this concept</em></div> / ,  (18)-<div><em>Skip / I don&#39;t know this concept</em></div> / ,  (19)-<div><em>Skip / I don&#39;t know this concept</em></div> / ,  (20)-<div><em>Skip / I don&#39;t know this concept</em></div> / ,  (21)-<div><em>Skip / I don&#39;t know this concept</em></div> / ,  (22)-<div><em>Skip / I don&#39;t know this concept</em></div> / ,  (23)-<div><em>Skip / I don&#39;t know this concept</em></div> / ,  (24)-<div><em>Skip / I don&#39;t know this concept</em></div> / ,  (25)-<div><em>Skip / I don&#39;t know this concept</em></div> / ,  (26)-<div><em>Skip / I don&#39;t know this concept</em></div> / ,  (27)-<div><em>Skip / I don&#39;t know this concept</em></div> / ,  (28)-<div><em>Skip / I don&#39;t know this concept</em></div> / ,  (29)-<div><em>Skip / I don&#39;t know this concept</em></div> / ,  (30)-<div><em>Skip / I don&#39;t know this concept</em></div> / ,  (31)-<div><em>Skip / I don&#39;t know this concept</em></div> / ,  (32)-<div><em>Skip / I don&#39;t know this concept</em></div> / ,  (33)-<div><em>Skip / I don&#39;t know this concept</em></div> / ,  (34)-<div><em>Skip / I don&#39;t know this concept</em></div> / ,  (35)-<div><em>Skip / I don&#39;t know this concept</em></div> / ,  (36)-<div><em>Skip / I don&#39;t know this concept</em></div> / ,  (37)-<div><em>Skip / I don&#39;t know this concept</em></div> / ,  (38)-<div><em>Skip / I don&#39;t know this concept</em></div> / ,  (39)-<div><em>Skip / I don&#39;t know this concept</em></div> / ,  (40)-<div><em>Skip / I don&#39;t know this concept</em></div> / ,  (41)-<div><em>Skip / I don&#39;t know this concept</em></div> / ,  (42)-<div><em>Skip / I don&#39;t know this concept</em></div> / ,  (43)-<div><em>Skip / I don&#39;t know this concept</em></div> / ,  (44)-<div><em>Skip / I don&#39;t know this concept</em></div> / ,  (45)-<div><em>Skip / I don&#39;t know this concept</em></div> / ,  (46)-<div><em>Skip / I don&#39;t know this concept</em></div> / ,  (47)-<div><em>Skip / I don&#39;t know this concept</em></div> / ,  (48)-<div><em>Skip / I don&#39;t know this concept</em></div> / ,  (49)-<div><em>Skip / I don&#39;t know this concept</em></div> / ,  (50)-<div><em>Skip / I don&#39;t know this concept</em></div> / ,,,"Thank you for rating those.  We just have a few more questions for you to finish the survey. Plea...-POWER (social power, authority, wealth)","Thank you for rating those.  We just have a few more questions for you to finish the survey. Plea...-ACHIEVEMENT (success, capability, ambition, influence on people and events)","Thank you for rating those.  We just have a few more questions for you to finish the survey. Plea...-HEDONISM (gratification of desires, enjoyment in life, self-indulgence)","Thank you for rating those.  We just have a few more questions for you to finish the survey. Plea...-STIMULATION (daring, a varied and challenging life, an exciting life)","Thank you for rating those.  We just have a few more questions for you to finish the survey. Plea...-SELF-DIRECTION (creativity, freedom, curiosity, independence, choosing one's own goals)","Thank you for rating those.  We just have a few more questions for you to finish the survey. Plea...-UNIVERSALISM (broad-mindedness, beauty of nature and arts, social   justice, a world at peace, equality, wisdom, unity with nature, environmental protection)","Thank you for rating those.  We just have a few more questions for you to finish the survey. Plea...-BENEVOLENCE (helpfulness, honesty, forgiveness, loyalty, responsibility)","Thank you for rating those.  We just have a few more questions for you to finish the survey. Plea...-TRADITION (respect for tradition, humbleness, accepting one's portion in life, devotion, modesty)","Thank you for rating those.  We just have a few more questions for you to finish the survey. Plea...-CONFORMITY (obedience, honoring parents and elders, self-discipline, politeness)","Thank you for rating those.  We just have a few more questions for you to finish the survey. Plea...-SECURITY (national security, family security, social order, cleanliness, reciprocation of favors)","When you think about politics, where would you rate yourself along the following scale?","If you had to choose just one category to describe your political views, which would you choose?","If you had to choose just one category to describe your political views, which would you choose?-TEXT",What is your religion?,What is your religion?-TEXT,"If you identify with a particular religious denomination, please write your religious denominatio...","Thank you for taking part in this study! If you have feedback or encountered any problems, please...",Your unique validation code for mTurk is ZK${e://Field/mTurkCode}.   Use of this code multiple ti...,LocationLatitude,LocationLongitude,LocationAccuracy
R_C3nIUsFhCVWWhqh,Default Response Set,Anonymous,,,76.179.113.201,0,5/24/16 11:25,5/24/16 11:44,1,,2989271,7,2,1,2,1,A1IM6TFN3AAMBY,1,1,,maine,21,white,3,1,2,1,1,2,1,1.7,1,-0.3,1,1,,4,2.7,2.1,1,0.2,0.9,1.6,m,-4,m,1.8,2.7,0.2,0,-0.2,0.8,m,m,1.3,0.7,-0.3,2.6,3.1,2.6,1.6,4,3.7,m,m,1.2,3.5,3.4,-1.9,2.8,1.6,2.6,2,4,-0.7,-0.8,-0.1,1.4,3.2,4,-0.9,-2,1.3,-0.9,m,4,1.7,1.4,1.4,-2.1,-1.3,1.5,2.2,m,-4,m,1.6,-1.8,2.1,0,1.6,1.8,m,m,2.2,1.1,-0.4,0.9,2.3,1.1,0.8,3.2,4,m,m,1.5,1.3,4,-1.5,4,1.9,-2.3,-0.3,3.3,0.7,-1.5,0,1.3,-2.4,4,-0.7,0.1,1.1,0.7,m,3.4,1,1.3,-0.3,0.7,-1.4,-1.2,3.6,m,-4,m,-1.6,-1.1,2.6,-0.1,0.5,-0.1,m,m,-0.1,-0.1,-1.1,-0.4,-2.2,-1.4,2.9,-1.5,-1.9,m,m,1.9,0.8,0,0.7,4,2.3,1.6,-1.1,-1.4,0.4,1.8,-1.3,-0.7,2.7,4,-0.7,0.2,1.3,-1.2,m,-2.3,,7,564.58,129,4.38,1.917879904,0.590396232,0.16412689,0.153393857,0.153393857,81,44,1.840909091,0.543209877,,,,,,,,,1,,1,,,,,,,1,1,,,,,,,,,,1,1,,,,,,,,,,,,,,,,,,,,1,,,,18,17,8,17,9,9,9,9,17,9,4,4,,8,,,should just let people rate all 50 on one page it would be waaaaaay faster and less boring.,1,43.39720154,-70.57219696,-1
R_3qCkq8u15v7nqp3,Default Response Set,Anonymous,,,99.174.241.243,0,5/23/16 10:37,5/23/16 10:55,1,,6724171,7,1,1,1,1,APH01L61YQ58J,1,1,,California,20,Latino,4,1,0,1,1,0.7,1,-0.2,1,-0.9,1,1,,4,3.5,2.5,3,-1.4,2.3,0.5,2,2.8,0.4,3,2.4,m,2.1,2.6,3.4,m,2.1,2.5,m,1.7,1.2,-0.5,1.5,1.9,4,1.8,-0.7,-0.7,2.1,2.8,m,2.5,1.5,1.6,4,2.5,2.5,4,1.1,3.2,3,3,2,3,2.1,m,2.6,1.4,1.6,1,1.7,2.5,3.3,-0.7,2.2,-0.8,2.7,3.5,0.9,2.1,2.2,m,2.4,2.3,2,m,2.6,1.7,m,1.7,3.8,1,1.4,1.5,2.2,1.1,-0.7,1.8,1.8,2.8,m,2,1.4,1.2,2.6,2,1.9,1.5,1.7,2.6,2,3.2,0,2,2.7,m,2,-0.6,1.8,2.6,1.8,3.1,2.5,-2.3,0.4,-0.9,0.5,-2.9,-1,1.9,0.3,m,2,2.9,1.7,m,0.5,2,m,2,-0.3,0.9,3,0.9,1.9,2.3,-0.1,0.8,2,2.9,m,1.6,2,1.5,2.1,2.6,1.7,0,1.3,2.4,1.6,3.9,0.6,0.7,1.7,m,2.6,0.7,2,,5,624.04,135,4.62,1.263920784,0.545694243,0.467852136,0.324667407,0.324667407,119,14,8.5,0.117647059,,,,,,,,,,,,,,,,,,1,,,,,,,,,,,,,,,,,,,,,,,,,,,,,,,,,,,,7,2,9,9,17,9,8,9,17,17,2,1,,8,,,,1,33.11759949,-117.1650009,-1
R_30tTHVqTXuc5LRS,Default Response Set,Anonymous,,,50.136.166.130,0,5/23/16 10:34,5/23/16 10:50,1,,4925659,7,1,2,2,1,A3PRZRK9IC5CBI,1,1,,California,41,White,3,1,4,1,1,4,1,4,1,4,1,1,,4,4,4,4,4,0,4,4,0,0,4,4,4,4,4,4,m,m,3,4,4,2.5,2,4,4,4,4,3.1,-2,2,4,4,4,m,4,3,2,2.1,4,2,4,4,4,4,4,-2,2,4,m,4,2,2.1,2,1.5,2,0,4,2.1,-2,0,4,2,4,4,0,2.1,m,m,0,2.1,4,3,4,4,2,1.5,4,4,2,4,2,4,2,m,4,2,2.1,2.1,1.9,3,0,4,2.1,2,0,4,2,4,m,4,0,0,0,0,-4,0,0,0,-2,0,0,0,0,2,-4,-4,m,m,0,-4,0,1.7,2,1.6,0,0,1.7,0,2,2,0,0,0,m,0,0,0,0,0,0,0,0,0,0,-2,4,0,0,m,0,,4,1035.59,138,7.50,2.052929756,0.223038226,-0.365209703,0.459736747,-0.365209703,88,9,9.777777778,0.102272727,,,,,,,,,,,,,,,,,,1,1,,,,,,,,,,,,,,,,1,,,,,,,,,,,,,,,1,,,,3,8,8,8,8,8,8,8,8,8,5,3,,2,,Catholic,,1,38.0493927,-122.1585999,-1
R_3rS7FYqa7pzbEk0,Default Response Set,Anonymous,,,68.6.205.247,0,5/23/16 10:57,5/23/16 11:06,1,,3955305,7,2,1,2,1,A1W7NEHKLKU0P,1,1,,California,39,White,5,1,3,1,1,2.9,1,3.1,1,2.1,1,1,,3.9,3,4,4,2.2,2,2.1,2.9,2,2.2,2,2,4,3,1.9,4,m,m,2,2.1,2.1,2,3.1,1.9,2,4,2,m,-2,2.9,3,3.1,2.1,2,2.8,2,2.1,3.9,3.1,-2,0.9,4,2.7,4,2.8,1,2.1,2,m,2.9,2.1,2,3.1,1.1,0.9,1,1,2.2,1,-0.8,2.8,1,3.2,4,-2,1,m,m,1,4,1.9,2,2.9,2.2,1.2,1.1,1,m,2,4,3.1,3.1,2,4,3.1,1.6,1.1,1.9,1,2,1.1,0.9,3,1.9,2.1,4,-1.1,2.1,m,3.1,1,0.8,1.9,1,-2.1,1,-1.1,1.9,-3,-1.1,1.8,-2,1,4,-4,1,m,m,-2,-1.1,-0.9,-1.1,2,2.9,0.9,1,2,m,1.9,3.1,1,1,0.9,3,1,-2.3,1.1,1,-1,2,-1,0,3,2,-2.2,3.9,-1,2,m,2.2,,4,761.01,138,5.51,1.682317349,0.079147998,0.040026948,0.655309392,0.040026948,117,20,5.85,0.170940171,,,,,,,,,,,,,,,,,,1,1,,,,,,,,,,1,,,,,,,,,,,,,,,,,,,,,1,,,,8,17,7,8,17,9,8,8,2,9,6,2,,2,,,,1,32.73710632,-117.0881042,-1
R_126lVDNHg7Eft2m,Default Response Set,Anonymous,,,96.19.253.164,0,5/23/16 12:24,5/23/16 12:38,1,,5224846,7,1,2,1,1,A3KX8PBHVFQZ3U,1,1,,Arizona,25,white,4,1,,1,1,3,1,1.5,1,-3.5,1,1,,4,4,4,3.7,-1.2,3,4,4,-2.4,1.9,4,2,4,4,4,4,m,m,4,3.4,3.8,0,1.6,2.4,1.7,4,4,2.6,2.4,3.1,4,4,4,3.2,4,2.8,0,3.1,1.8,1.5,3.5,3.1,2.6,3.5,4,-2.1,2.4,3.9,m,3.1,1.9,-1.1,1.9,0.9,-1.7,1.8,3.4,2.9,-2.3,2.1,0.9,1,4,4,0,1,m,m,1.8,3,4,2.3,0.8,2.3,1.4,1.1,1.6,1.1,3.4,4,4,4,2.3,2.9,3.4,1.9,-1.8,0,-1.9,0.4,0.9,-2.1,4,1.9,2,0.7,0,2,m,0,1.1,2.1,0,1.9,0,0,2.6,0,-4,-0.9,2,2.9,0,1.8,-4,-3.6,m,m,-1.9,1.9,0,0,4,4,3.2,1.1,1.7,2.1,1.5,0,0,2.4,0,4,2.8,0,-1.7,-1.8,-1.4,0.7,1.4,2.9,3.6,-2.6,0,1.8,3.5,3,m,3.7,,3,992.97,141,7.04,1.997748846,0.494743766,0.126567438,0.236773484,0.126567438,105,18,5.833333333,0.171428571,,,,,,,,,,,,,,,,,,1,1,,,,,,,,,,,,,,,,,,,,,,,,,,,,,,,1,,,,7,7,9,8,18,8,8,1,2,8,4,1,,8,,,,1,32.70379639,-109.6557999,-1
R_1FffyWblWgXXIf8,Default Response Set,Anonymous,,,104.3.156.137,0,5/23/16 10:29,5/23/16 11:00,1,,3781661,7,1,1,1,1,AIOOOO5OXWXKM,1,1,,California,26,Hispanic,4,1,0.1,1,1,-0.1,1,-1,1,-2,1,1,,4,4,4,2,4,0,0,4,-1,0,0,0,4,0,4,4,m,m,3,-0.9,2.1,0,0,0,0,4,4,0,-2,4,0,2.1,1,3,0,4,0,4,4,0,0,4,m,0,2,0,0,0,0,0,2,4,2,-1,0,1,-1,2,-1,0,1,2,4,4,-2,1,m,m,2,1,2,4,2,2,0,4,2,0,-1.1,4,2,-2,0,2,0,4,0,4,0.1,-1,3.1,3,m,2,1.1,4,0,1,-2,1,-1,2,1.1,0,0,0,-1,-3,-4,2,-2,2,-2,4,-3,-1,m,m,-1,2,-2,4,4,3,1.1,1,4,4,2,4,0,-2.1,2,3,-1,2,2,2,1.1,1,2,0,m,2,1,4,4,2,1,1,,3,774.71,141,5.49,1.962651371,0.347379304,-0.226069135,0.36321156,-0.226069135,83,23,3.608695652,0.277108434,,,,,,,,,,,,,,,,,,1,1,,,,,,,,,,,,,,,,,,,,,,,,,1,,,,,,,,,,7,8,9,7,9,17,9,7,8,8,2,1,,7,,,,1,34.08869934,-118.3278046,-1
R_2YxqesOiUKXjAwU,Default Response Set,Anonymous,,,24.88.83.53,0,5/23/16 10:34,5/23/16 10:43,1,,166823,7,2,2,2,1,A6P0CC8HHZLFJ,1,1,,SC,27,white,4,1,,1,1,1.2,1,1.5,1,1.1,1,1,,1.8,2,3.4,2.1,0,1.9,2.5,2.5,3.4,2.7,2,2.1,1.4,0.8,4,2.8,2.2,0,2.1,3,2.7,2.2,1.8,2.3,1,3,2.7,m,-1.7,2.8,3.1,1.2,1.6,2.4,3,2.1,2.1,2.5,3.3,2.3,3.3,2,2.5,2.1,2,0,m,2.4,m,2,1,2,3.8,2.2,-0.5,1.4,2.7,0.2,3.3,1.6,2,0.5,2.3,0.5,3.2,-0.8,2.2,-0.1,2.2,3,2.6,1.1,2,2.4,1.1,2.3,1.4,m,1,2.8,2.9,3,0.9,2.7,3,1.9,0.9,2.4,3.7,2.2,4,1.9,2.6,2.1,3,3,m,2.5,m,2,0,-1.3,-2,-1.5,-2.5,0.9,0,-2,-2.2,-1.2,-1.6,-0.7,-0.5,2.2,-4,-1.8,-0.2,0,-1,-2.1,-1.5,-1,0.9,1.4,0.9,-0.7,2.1,m,1.4,0.7,0.5,-0.8,-1.2,2.3,-1.2,0.9,-1.8,-2.2,-0.8,-1.7,-1.7,0.1,1.5,-2.1,-1.2,-1.6,m,2.1,m,-0.6,,3,614.89,141,4.36,1.721383399,0.510246688,-0.272603023,-0.105756018,-0.272603023,101,34,2.970588235,0.336633663,,,,,,,,,,,,,,,,,,,,,,,,,,,,,1,,,,,,,,,,,,,,,,,,,1,,1,,,,3,3,3,2,8,9,9,3,1,17,5,5,,9,,,,1,34.0007019,-81.03479767,-1
R_20SP6lxzfB8X8QX,Default Response Set,Anonymous,,,74.71.163.62,0,5/24/16 9:19,5/24/16 9:31,1,,2600819,7,1,2,1,1,ADKKDK6P4MS1Z,1,1,,new york,36,hispanic,3,1,1.5,1,1,4,1,4,1,3.9,1,1,,4,4,4,4,4,3,4,4,0,2.1,4,4,4,2.1,0,4,3.9,4,2.1,2,4,3.2,3.9,2.2,2,4,4,m,m,4,3,3.9,2,3.9,4,4,4,4,4,4,4,4,3.1,4,3.9,-2.9,0,3.9,0,4,0,2,1.9,2,0,1.2,4,2.1,0,0,3.1,2,2.1,3.9,0,0,4,3.7,0,3,2.8,4,2.9,2.1,1,0,0,m,m,3.9,0.1,4,3.1,4,2.8,1,0,0,0.9,1.9,0,0,1.9,0,1,4,0,1.9,-2,2,0,0,0,0,0,1.1,1.2,0,-0.9,-1,0.1,2,0,2,-4,0,2,0,-1,0,0,0.1,3,2,1.9,0,1.5,m,m,2,2.2,0,2.2,2.8,0,0,1.2,0,0,2.9,0,0,2.1,1.1,0,2.9,0,2,-3.1,3,,2,949.29,144,6.59,1.81924498,0.119729746,0.19834225,0.493553904,0.119729746,97,7,13.85714286,0.072164948,,,,,,,,,,,,,,,,,,,,,,,,,,,,,1,1,,,,,,,,,,,,,,,,,,,,,,,,7,17,9,9,9,17,18,17,2,18,1,1,,2,,catholic,thanks,1,40.79100037,-73.92559814,-1
